{
  "portfolio_id": "lovefu-hillbed-search-rsa-real-uat-v1-2",
  "source_interpretation_id": "lovefu-hillbed-search-rsa-real-uat-v1-2",
  "brand_name": "LOVEFU大島樂眠",
  "product_name": "山丘樂眠床",
  "campaign_type": "search_rsa",
  "generated_by": "codex",
  "generated_at": "2026-03-16T00:28:26+08:00",
  "angle_taxonomy": {
    "version": "v1.2",
    "keys": [
      "product_feel",
      "risk_reversal",
      "brand_trust",
      "entry_value",
      "life_scene",
      "concrete_number",
      "pain_point",
      "social_proof",
      "legacy_phrase",
      "cta_lower_friction"
    ]
  },
  "final_asset_pack": {
    "primary": [
      {
        "asset_id": "hl-01",
        "text": "200kg 不塌陷，最好睡的撐腰床墊",
        "asset_type": "headline",
        "role": "主力",
        "source": "retained",
        "angle_key": "concrete_number",
        "performance_tier": "top",
        "decision_confidence": "directional",
        "decision_basis_metric": "association_proxy_only",
        "observe_subtype": null,
        "risk_level": null,
        "rewrite_mode": null,
        "is_protected_phrase_carrier": false,
        "char_count": 18,
        "coverage_tags": {
          "protected_phrases": [],
          "must_include_tokens": [],
          "reusable_motifs": [
            "concrete-number",
            "pain-point-solution"
          ]
        }
      },
      {
        "asset_id": "hl-02",
        "text": "大島樂眠 LOVEFU 飄雲專利床墊",
        "asset_type": "headline",
        "role": "主力",
        "source": "retained",
        "angle_key": "brand_trust",
        "performance_tier": "top",
        "decision_confidence": "directional",
        "decision_basis_metric": "association_proxy_only",
        "observe_subtype": null,
        "risk_level": null,
        "rewrite_mode": null,
        "is_protected_phrase_carrier": false,
        "char_count": 18,
        "coverage_tags": {
          "protected_phrases": [],
          "must_include_tokens": [
            "LOVEFU",
            "飄雲專利"
          ],
          "reusable_motifs": [
            "trust-proof"
          ]
        }
      },
      {
        "asset_id": "hl-06",
        "text": "100 天安心睡計畫，改善睡眠品質",
        "asset_type": "headline",
        "role": "主力",
        "source": "retained_protected_phrase",
        "angle_key": "risk_reversal",
        "performance_tier": "top",
        "decision_confidence": "directional",
        "decision_basis_metric": "association_proxy_only",
        "observe_subtype": null,
        "risk_level": null,
        "rewrite_mode": null,
        "is_protected_phrase_carrier": true,
        "char_count": 17,
        "coverage_tags": {
          "protected_phrases": [
            "100天安心睡"
          ],
          "must_include_tokens": [],
          "reusable_motifs": [
            "lower-friction-cta"
          ]
        }
      },
      {
        "asset_id": "hl-07",
        "text": "專為台灣人的睡眠需求設計",
        "asset_type": "headline",
        "role": "主力",
        "source": "retained",
        "angle_key": "brand_trust",
        "performance_tier": "top",
        "decision_confidence": "directional",
        "decision_basis_metric": "association_proxy_only",
        "observe_subtype": null,
        "risk_level": null,
        "rewrite_mode": null,
        "is_protected_phrase_carrier": false,
        "char_count": 12,
        "coverage_tags": {
          "protected_phrases": [],
          "must_include_tokens": [],
          "reusable_motifs": []
        }
      },
      {
        "asset_id": "hl-09",
        "text": "LOVEFU 飄雲床墊，樂眠好評如潮",
        "asset_type": "headline",
        "role": "主力",
        "source": "retained",
        "angle_key": "social_proof",
        "performance_tier": "top",
        "decision_confidence": "directional",
        "decision_basis_metric": "association_proxy_only",
        "observe_subtype": null,
        "risk_level": null,
        "rewrite_mode": null,
        "is_protected_phrase_carrier": false,
        "char_count": 18,
        "coverage_tags": {
          "protected_phrases": [],
          "must_include_tokens": [
            "LOVEFU"
          ],
          "reusable_motifs": [
            "trust-proof"
          ]
        }
      },
      {
        "asset_id": "hl-11",
        "text": "指定配送日，LOVEFU 配送超方便",
        "asset_type": "headline",
        "role": "主力",
        "source": "retained",
        "angle_key": "cta_lower_friction",
        "performance_tier": "top",
        "decision_confidence": "directional",
        "decision_basis_metric": "association_proxy_only",
        "observe_subtype": null,
        "risk_level": null,
        "rewrite_mode": null,
        "is_protected_phrase_carrier": false,
        "char_count": 18,
        "coverage_tags": {
          "protected_phrases": [],
          "must_include_tokens": [
            "LOVEFU"
          ],
          "reusable_motifs": [
            "lower-friction-cta",
            "trust-proof"
          ]
        }
      },
      {
        "asset_id": "hl-12",
        "text": "2026 護脊床墊推薦 - 山丘樂眠床",
        "asset_type": "headline",
        "role": "主力",
        "source": "retained",
        "angle_key": "legacy_phrase",
        "performance_tier": "top",
        "decision_confidence": "directional",
        "decision_basis_metric": "association_proxy_only",
        "observe_subtype": null,
        "risk_level": null,
        "rewrite_mode": null,
        "is_protected_phrase_carrier": false,
        "char_count": 19,
        "coverage_tags": {
          "protected_phrases": [],
          "must_include_tokens": [
            "山丘樂眠床"
          ],
          "reusable_motifs": [
            "concrete-number",
            "trust-proof"
          ]
        }
      },
      {
        "asset_id": "hl-39",
        "text": "山丘樂眠床 第2張床 擁有支撐腰背與放鬆的魔法",
        "asset_type": "headline",
        "role": "主力",
        "source": "retained_observe",
        "angle_key": "life_scene",
        "performance_tier": "borderline",
        "decision_confidence": "directional",
        "decision_basis_metric": "association_proxy_only",
        "observe_subtype": "observe_borderline",
        "risk_level": null,
        "rewrite_mode": null,
        "is_protected_phrase_carrier": false,
        "char_count": 23,
        "coverage_tags": {
          "protected_phrases": [],
          "must_include_tokens": [
            "山丘樂眠床"
          ],
          "reusable_motifs": [
            "pain-point-solution",
            "support-feel"
          ]
        },
        "status_note": "以 observe_borderline 身分保留，下一輪若 proxy 仍未上升則移出。"
      },
      {
        "asset_id": "cand-h03",
        "text": "LOVEFU山丘樂眠床，支撐包覆更到位",
        "asset_type": "headline",
        "role": "主力",
        "source": "replacement",
        "angle_key": "product_feel",
        "performance_tier": "new",
        "decision_confidence": "low",
        "decision_basis_metric": null,
        "observe_subtype": null,
        "risk_level": "low",
        "rewrite_mode": "retain-intent",
        "is_protected_phrase_carrier": false,
        "char_count": 19,
        "coverage_tags": {
          "protected_phrases": [],
          "must_include_tokens": [
            "LOVEFU",
            "山丘樂眠床"
          ],
          "reusable_motifs": [
            "support-feel"
          ]
        }
      },
      {
        "asset_id": "cand-h04",
        "text": "LOVEFU山丘樂眠床，先接住腰背再放鬆",
        "asset_type": "headline",
        "role": "主力",
        "source": "replacement",
        "angle_key": "product_feel",
        "performance_tier": "new",
        "decision_confidence": "low",
        "decision_basis_metric": null,
        "observe_subtype": null,
        "risk_level": "low",
        "rewrite_mode": "retain-intent",
        "is_protected_phrase_carrier": false,
        "char_count": 20,
        "coverage_tags": {
          "protected_phrases": [],
          "must_include_tokens": [
            "LOVEFU",
            "山丘樂眠床"
          ],
          "reusable_motifs": [
            "support-feel",
            "lower-friction-cta"
          ]
        }
      },
      {
        "asset_id": "cand-h05",
        "text": "100天安心睡，先試睡再決定",
        "asset_type": "headline",
        "role": "主力",
        "source": "expansion",
        "angle_key": "cta_lower_friction",
        "performance_tier": "new",
        "decision_confidence": "low",
        "decision_basis_metric": null,
        "observe_subtype": null,
        "risk_level": "low",
        "rewrite_mode": "exploratory",
        "is_protected_phrase_carrier": true,
        "char_count": 14,
        "coverage_tags": {
          "protected_phrases": [
            "100天安心睡"
          ],
          "must_include_tokens": [],
          "reusable_motifs": [
            "lower-friction-cta"
          ]
        }
      },
      {
        "asset_id": "desc-02",
        "text": "100 天安心睡，帶你最需要的放鬆、慵懶。最好躺的 LOVEFU 硬床，不再睡睡醒醒，一覺到天明。",
        "asset_type": "description",
        "role": "主力",
        "source": "retained_protected_phrase",
        "angle_key": "risk_reversal",
        "performance_tier": "top",
        "decision_confidence": "directional",
        "decision_basis_metric": "association_proxy_only",
        "observe_subtype": null,
        "risk_level": null,
        "rewrite_mode": null,
        "is_protected_phrase_carrier": true,
        "char_count": 49,
        "coverage_tags": {
          "protected_phrases": [
            "100天安心睡"
          ],
          "must_include_tokens": [
            "LOVEFU"
          ],
          "reusable_motifs": [
            "lower-friction-cta",
            "support-feel",
            "trust-proof"
          ]
        }
      },
      {
        "asset_id": "cand-d02",
        "text": "LOVEFU飄雲專利床墊，以穩定支撐搭配柔軟包覆，延續高評價的無壓睡感。",
        "asset_type": "description",
        "role": "主力",
        "source": "safer_rewrite",
        "angle_key": "social_proof",
        "performance_tier": "new",
        "decision_confidence": "medium",